;ID-NZZ;sentence;Funktion-Hit;Head;ID-Head;Meta-Kopf;Function-Head;ID-Token
2948532;NZZ_1995_01_17_a20_seg8_s9;In einem wichtigen Wahljahr darf auch nicht unerwähnt bleiben , dass Gaillot vehement die Ausländerpolitik von Innenminister Pasqua angegriffen hatte und der Vatikan deshalb gleichzeitig versicherte , dass die vatikanischen Kontakte mit Pasqua bei der Revokation von Gaillot keine Rolle gespielt hätten .;ADJD;angreifen;19;Full|Psp;VVPP;13
2949480;NZZ_1995_01_17_a66_seg5_s7;Bonn werde sich vehement jeder Aufweichung der Maastrichter Stabilitätskriterien , wie sie vom italienischen Aussenminister angedeutet worden war , widersetzen .;ADJD;sein;18;Sein|3|Sg|Past|Ind;VAFIN;4
2964033;NZZ_1995_01_19_a179_seg3_s8;Martina Hingis stritt nach der ärgerlichen Niederlage den Verdacht , die Gegnerin unterschätzt zu haben , vehement ab .;ADJD;streiten;3;Full|3|Sg|Past|Ind;VVFIN;17
2991392;NZZ_1995_01_25_a68_seg5_s8;Staatsanwältin Marcia Clark argumentierte vehement gegen den Antrag und unterstellte der Verteidigung , dass sie die Juroren mit Simpsons « Charisma » beeinflussen wolle .;ADJD;argumentieren;4;Full|3|Sg|Past|Ind;VVFIN;5
2995485;NZZ_1995_01_25_a188_seg12_s15;Der Allenbach , ein äusserlich vergleichbarer Gebirgsbach , reagiert dagegen vehement auf Gewitter .;ADJD;reagieren;9;Full|3|Sg|Pres|Ind;VVFIN;11
3002582;NZZ_1995_01_26_a218_seg6_s3;Während Pestalozzi als deren dezidierter Vertreter allgemein bekannt ist , wissen nur wenige , dass bereits zu Beginn des letzten Jahrhunderts sich auch Frauen vehement für die schulische Mädchenbildung einsetzten .;ADJD;einsetzen;30;Full|3|Pl|Past|Ind;VVFIN;25
3006984;NZZ_1995_01_27_a139_seg8_s5;SVP-Präsident Nationalrat Christoph Blocher setzte sich vehement für die Erhaltung der bürgerlichen Mehrheit im Regierungsrat ein .;ADJD;setzen;5;Full|3|Sg|Past|Ind;VVFIN;7
3009740;NZZ_1995_01_28_a6_seg3_s1;R. M. Washington , 27. Januar Aussenminister Christopher hat ein Gesetzesprojekt der Republikaner im Kongress vehement attackiert , das den Entscheidungsspielraum des Präsidenten für amerikanische Beiträge zu Uno- Friedensmissionen rigoros einschränken soll .;ADJD;attackieren;17;Full|Psp;VVPP;16
3016743;NZZ_1995_01_28_a211_seg8_s15;"Für das Gesamtwerk von Porchia hat er sich zusammen mit seiner Frau , der Lyrikerin Laura Cerrato , vehement eingesetzt ; ihr ist es zu verdanken , dass nach jahrelangen Recherchen die « Vergessenen , verschollenen und unveröffentlichten Stimmen » seit kurzem wieder zugänglich sind .";ADJD;einsetzen;20;Full|Psp;VVPP;19
3019617;NZZ_1995_01_30_a107_seg5_s2;Ein von allen Gegnern des Gatekeeper-Modells und besonders vehement von den Rheumatologen Balz Kleinert und Andreas Wüest vorgetragenes Argument ist die ungeklärte Qualitätssicherung der ärztlichen Behandlung .;ADJD;Balz;13;Reg|Nom|Sg|Fem;NN;9
3019877;NZZ_1995_01_30_a117_seg12_s12;Die Delegierten weisen den Vorwurf indessen vehement zurück und betonen , « wie ernst uns die Mitarbeit aller Mitglieder bei unserer Interessenvertretung ist » .;ADJD;weisen;3;Full|3|Pl|Pres|Ind;VVFIN;7
3021997;NZZ_1995_01_30_a161_seg7_s6;Obschon er Sozialismus , « der durch Gewalt erreicht wird » , stets vehement ablehnt , finden sich in seinen Tagebüchern Zeugnisse einer naiven Bewunderung der Sowjetunion , die zur sonstigen Klarheit seines Urteils in merkwürdigem Kontrast stehen .;ADJD;ablehnen;15;Full|3|Sg|Pres|Ind;VVFIN;14
3022973;NZZ_1995_07_01_a37_seg3_s4;Die Steueramnestie war dem Bundesrat vom Parlament durch eine Motion des Walliser CVP- Ständerates Edouard Delalay aufgezwungen worden , insbesondere Bundesrat Otto Stich hatte sich immer vehement dagegen ausgesprochen .;ADJD;aussprechen;29;Full|Psp;VVPP;27
3030797;NZZ_1995_07_03_a25_seg2_s7;Sie alle äusserten vehement die Ansicht , jegliche neue protektionistische Strömung wäre Gift für die mit der Gründung der WTO Anfang Jahr erzielten Fortschritte im Welthandel .;ADJD;äußern;3;Full|1|Pl|Past|Subj;VVFIN;4
3031094;NZZ_1995_07_03_a40_seg7_s5;Gleichzeitig sei allerdings klar , fügte Rosmarie Bär bei , dass sich die Grünen vehement gegen den geplanten Abbau von Volksrechten in der Schweiz zur Wehr setzen müssten .;ADJD;setzen;27;Full|-2;VVINF;15
3042079;NZZ_1995_07_05_a18_seg4_s2;Am Dienstag hat sich an einer Pressekonferenz in Zürich eine Dreierdelegation aus dem französischen Südpazifik vehement gegen die von Frankreich ab Herbst geplanten Atombombentests auf Moruroa ausgesprochen .;ADJD;.;28;Pun|Sent;$.;16
3045659;NZZ_1995_07_05_a133_seg6_s31;Auch stellt Hatt vehement in Abrede , die Aktienkapitalerhöhungen hätten etwas mit dem Konkurs zu tun gehabt .;ADJD;stellen;2;Full|3|Sg|Pres|Ind;VVFIN;4
3047186;NZZ_1995_07_06_a3_seg8_s2;Der dem rechten Flügel angehörende Politiker wird ersetzt durch den gemässigteren William Waldegrave , bisher Landwirtschaftsminister , der von Tierschützern eine Zeitlang vehement bekämpft wurde .;ADJD;bekämpfen;24;Full|Psp;VVPP;23
3055954;NZZ_1995_07_07_a122_seg3_s18;Referiert wurde die gängige Auffassung , wonach das Melon , eine Aufwölbung der Stirn , als « akustische Linse » fungiere - eine Hypothese , der etwa der Berner Hirnanatom Georg Pilleri auf Grund seiner Forschungen an Flussdelphinen vehement entgegengetreten ist .;ADJD;entgegentreten;40;Full|Psp;VVPP;39
3078374;NZZ_1995_07_12_a14_seg8_s3;Erst im letzten Satz seiner Erwiderung auf die Kritik der Parlamentarier ging Chirac auf die Atomtests ein , die vom Sprecher der Grünen , Wolf , als Arroganz der Macht besonders vehement kritisiert wurden .;ADJD;kritisieren;33;Full|Psp;VVPP;32
3094826;NZZ_1995_07_15_a22_seg8_s13;Die drei mitteilsamen , cleveren , leicht angeheiterten Studenten betonen ( eine Spur zu vehement ?;ADJD;zu;14;Deg;APPR;15
3099672;NZZ_1995_07_15_a142_seg5_s15;Schäuble setzt sich vehement für die Abschaffung des Einstimmigkeitsprinzips zugunsten eines Mehrheitsentscheides ein .;ADJD;setzen;2;Full|3|Sg|Pres|Ind;VVFIN;4
3100811;NZZ_1995_07_15_a176_seg8_s1;1932 hatte Rudolf Arnheims Schrift « Film als Kunst » noch vehement den grundlegenden Hang des Farbenfilms zur Raumillusion kritisiert , weil er bloss Wirklichkeit kopiere , anstatt ihre « stilisierende Übertragung auf eine qualitativ andere Farbwelt » zu ermöglichen .;ADJD;kritisieren;20;Full|Psp;VVPP;12
3104997;NZZ_1995_07_17_a115_seg2_s6;In der Band , welche auch die eher schwächeren , kitschigen Charts mit typisch amerikanischer Coolness und Überzeugung kraftvoll in den Saal schmettert , sitzen namhafte Avantgardisten , die sich bis vor wenigen Jahren bestimmt vehement geweigert hätten , solch konventionelle , auf vorbestimmten Time- und Chord-Strukturen basierenden Nummern aufzuführen .;ADJD;weigern;37;Full|Psp;VVPP;36
3110451;NZZ_1995_07_18_a124_seg4_s22;Zum Verhängnis wurde dem ehemaligen Bezirksanwalt auch eine Tonbandaufzeichnung , die Rechtsanwalt Zardin von dem anfänglich von Blattmer vehement in Abrede gestellten Telefonat vom 14. Juni 1990 erstellt hatte .;ADJD;gestellt;22;Pos|Dat|Sg|Neut;ADJA;19
3110666;NZZ_1995_07_18_a139_seg3_s22;Sie wehrt sich vehement dagegen , eine Vertreterin irgendeiner Zugehörigkeit zu sein .;ADJD;wehren;2;Full|3|Sg|Pres|Ind;VVFIN;4
3111688;NZZ_1995_07_19_a1_seg8_s6;"Eine nicht unwesentliche Rolle mögen dabei auch Meinungsverschiedenheiten innerhalb von CiU gespielt haben , die ( wie ihr Name sagt ) eine aus zwei Partnern bestehende Gruppierung ist ; der kleinere Partner von Pujols Convergència Democràtica de Catalunya , nämlich die stark katholisch geprägte Unió Democràtica , hatte sich vehement gegen die Absicht der spanischen Sozialisten gewandt , die gegenwärtige Gesetzgebung zum Schwangerschaftsabbruch - eine im europäischen Vergleich eher restriktive Indikationenlösung - zu lockern .";ADJD;wenden;57;Full|Psp;VVPP;50
3115117;NZZ_1995_07_19_a109_seg4_s29;Ohne die Qualität des Münsterhofes als Platz zu überschätzen , plädieren wir vehement gegen ein Barackendorf zwischen Fraumünster , « Waag » und « Meisen » .;ADJD;plädieren;11;Full|1|Pl|Pres|Ind;VVFIN;13
3159158;NZZ_1995_07_28_a153_seg5_s15;Zwar kam der Berliner Senat den Forderungen des Deutschen Tennisbundes nach einem Ausbau der Berliner Anlage mit einem Zuschuss von 20 Millionen Mark nach , doch Naturschutzfreunde trachten diesen Ausbau bisher vehement zu verhindern .;ADJD;verhindern;34;Full|-2;VVINF;32
3161001;NZZ_1995_07_29_a24_seg6_s14;Die Liberalen , die zusammen mit den Grünen am entschiedensten für eine nichtdiskriminierende Homosexuellen-Gesetzgebung eintreten , wenden sich vehement gegen die Methode der Aktivisten .;ADJD;wenden;17;Full|3|Pl|Pres|Ind;VVFIN;19
3162733;NZZ_1995_07_29_a92_seg5_s5;All dem haben die Vertreter der amtlichen und freien Makler in der Hauptversammlung vehement widersprochen .;ADJD;widersprechen;15;Full|Psp;VVPP;14
3169374;NZZ_1995_06_30_a89_seg7_s4;Er wehrt sich deshalb vehement gegen einen Abbau der Förderung von benachteiligten Studierenden .;ADJD;wehren;2;Full|3|Sg|Pres|Ind;VVFIN;5
3170065;NZZ_1995_06_30_a117_seg9_s4;"Jaccottet kennt die eigenen Grenzen ; Gesellschaftskritik ist nur am Rande - dort aber vehement - seine Sache .";ADJD;Rand;11;Reg|Dat|Sg|Masc;NN;15
3174419;NZZ_1995_06_01_a6_seg6_s14;Der streitbare Labour-Abgeordnete Tony Benn äusserte sich vehement gegen einen « Blankocheck » mit dem Leben britischer Soldaten für die Regierung und forderte eine Abstimmung .;ADJD;äußern;6;Full|3|Sg|Past|Ind;VVFIN;8
3178728;NZZ_1995_06_01_a151_seg2_s9;Es sind dies die Töchter jener Frauen im Krieg , die Käthe Kollwitz in ihrer graphischen Folge « Bauernkrieg » ( 1903-1908 ) so kraftvoll dargestellt hat , aber auch die Töchter Käthe Kollwitz ' und ihrer Zeitgenossinnen , die sich so vehement und doch so vergeblich gegen den Krieg gewandt haben .;ADJD;und;44;Coord|-2;KON;43
3182113;NZZ_1995_06_02_a78_seg7_s4;Diese drei Länder könnten bis zur Jahrtausendwende unter Umständen ein konföderationsartiges Gebilde oder eine Art ( vom kasachischen Präsidenten Nasarbajew seit dem Frühjahr vehement propagierter ) « Euroasiatischer Union » werden .;ADJD;--;25;Pos|Nom|Sg|Masc;ADJD;24
3184519;NZZ_1995_06_02_a131_seg8_s7;Des weiteren bestritt Bindella vehement , 250 000 Franken für ein an Marina Kreutzmann gewährtes Darlehen selbst an sich zurückbezahlt zu haben .;ADJD;bestreiten;3;Full|3|Sg|Past|Ind;VVFIN;5
3193360;NZZ_1995_06_03_a156_seg3_s4;In den 80er Jahren hat er vehement gegen eine Verschärfung des Asylgesetzes gekämpft und sich in der Friedensbewegung engagiert .;ADJD;kämpfen;13;Full|Psp;VVPP;7
3203949;NZZ_1995_06_07_a80_seg6_s5;Beide kämpften vehement für eine klare Deklarierung .;ADJD;kämpfen;2;Full|3|Pl|Past|Ind;VVFIN;3
3214795;NZZ_1995_06_09_a12_seg6_s11;"Es sei zwar nicht auszuschliessen , dass Teile davon für diesen Eventualfall zum Einsatz kämen ; im offiziellen Communiqué der Ministertagung bekennt sich die Allianz aber vehement zu einem Verbleiben der Unprofor-Truppen .";ADJD;bekennen;22;Full|3|Sg|Pres|Ind;VVFIN;27
3229702;NZZ_1995_06_10_a212_seg4_s89;Vielleicht hängt das auch mit der Bodenständigkeit der irischen Jüdinnen und Juden zusammen , die der eben zitierte Mr. Deasy im « Ulysses » so vehement bestritten hatte .;ADJD;bestreiten;27;Full|Psp;VVPP;26
3230523;NZZ_1995_06_12_a16_seg6_s16;Innenminister Caspar Einem , der einen derartigen Schritt vehement ablehnt , steht bereits unter starkem Beschuss .;ADJD;ablehnen;10;Full|3|Sg|Pres|Ind;VVFIN;9
3240429;NZZ_1995_06_13_a143_seg28_s11;Wenn sich der Mieterverband sehr kritisch zur Änderung des Energiegesetzes äussert , die Baugenossenschaften sie klar ablehnen und die privaten Hauseigentümer und Vermieterorganisationen sich vehement dagegen aussprechen , wer ist eigentlich dafür ?;ADJD;aussprechen;27;Full|-2;VVFIN;25
3241176;NZZ_1995_06_13_a163_seg3_s3;Der sich abzeichnende Erfolg - die letzten beiden Gegner sind Tuggen und Gossau - löste in der Munotstadt um so grössere Genugtuung aus , als der vom Klub vehement bekämpfte Modus punkto Relegation ernste Risiken barg .;ADJD;bekämpft;30;Pos|Nom|Sg|Masc;ADJA;29
3245962;NZZ_1995_06_14_a134_seg12_s11;Altmann kritisierte ferner vehement die Umstände seiner Verhaftung als unverhältnismässig .;ADJD;kritisieren;2;Full|3|Sg|Past|Ind;VVFIN;4
3252368;NZZ_1995_06_15_a184_seg5_s19;Indem einzelne ihrer Ratsmitglieder vehement für die Erhaltung des Parkdecks polterten , unterminierten sie auch ein Kernstück der Verkehrspolitik , wie sie ihre eigene Stadträtin Kathrin Martelli ohne Pauken und Trompeten , aber mit Zähigkeit vorantreibt .;ADJD;poltern;11;Full|3|Pl|Past|Ind;VVFIN;5
3272704;NZZ_1995_06_19_a151_seg3_s3;Swiss Derby den Hengst Solon vehement an die Spitze beordert .;ADJD;beordern;10;Full|Psp;VVPP;6
3280170;NZZ_1995_06_20_a170_seg5_s6;Die Mannschaften von Zabel und Abduschaparow hatten zu spät vehement in die Pedale getreten .;ADJD;treten;14;Full|Psp;VVPP;10
3280970;NZZ_1995_06_21_a10_seg3_s4;Weil der Gerichtshof ein EU- Organ ist , die Europol aber rechtlich ausserhalb der EU , im sogenannten dritten Pfeiler des Maastricht-Vertrags , angesiedelt ist , wehrt sich Grossbritannien vehement gegen jede Funktion des EuGH , die über die bisherige Rechtsprechung hinausgeht .;ADJD;wehren;27;Full|3|Sg|Pres|Ind;VVFIN;30
3285139;NZZ_1995_06_21_a158_seg6_s10;Trotzdem stellte L. vehement in Abrede , ein « Kinderhasser » zu sein , als der er in der Öffentlichkeit apostrophiert worden war .;ADJD;stellen;2;Full|3|Sg|Past|Ind;VVFIN;4
3286395;NZZ_1995_06_21_a199_seg5_s18;Kein anderer Vertreter von Toleranz und Humanität hat sich so vehement gegen ihn gewandt .;ADJD;wenden;14;Full|Psp;VVPP;11
3300809;NZZ_1995_06_24_a34_seg1_s27;Und schliesslich ist daran zu erinnern , dass heute dieselben SP-Politiker , die sich noch vor kurzem vehement und kompromisslos gegen die Beschaffung von Kampfflugzeugen und ganz allgemein gegen Hochtechnologiesysteme ausgesprochen haben , heute für eine Verteidigungsstruktur eintreten , deren Kern Luftverteidigung , moderne Artillerie und hochentwickelte ballistische Sperrsysteme bilden .;ADJD;und;19;Coord|-2;KON;18
3311896;NZZ_1995_06_26_a161_seg2_s6;Zwei Temperamente prallen aufeinander in den Räumen , in welchen Urs Stahel der dégénération professionnelle , den photographischen Attitüden , Moden und Manierismen vehement ( wie selten ) die Tür gewiesen hat : mit Garnells wichtigsten Werkgruppen der letzten zehn Jahre und mit einer Farbreportage in 39 Bildern van Manens .;ADJD;selten;27;Pos;ADJD;24
3314388;NZZ_1995_06_27_a37_seg2_s13;Apropos Lega : Deren Chef Giuliano Bignasca , der sonst vehement für die Abschaffung der Lex Friedrich eintritt , bezeichnete den Ausgang der Abstimmung über deren Revision in einem Interview als einen « grossen Sieg einer kleinen Gruppe und eine weitere klare Demonstration , dass sich die Schweiz nicht Europa anschliessen will » .;ADJD;Friedrich;17;Name|Nom|Sg|Masc;NE;11
3329163;NZZ_1995_06_29_a177_seg7_s7;Weihaiweij könnte dannzumal zu viel wollen und zu vehement gegen die Hindernisse galoppieren .;ADJD;zu;8;Deg;APPR;9
3330741;NZZ_1995_05_31_a35_seg4_s11;Die chemische und pharmazeutische Industrie haben sich vehement gegen diese Formulierung gewandt , die nach ihrer Auffassung die meisten Forschungsarbeiten auf dem Gebiet der Gentechnologie verunmöglichen würde .;ADJD;wenden;12;Full|Psp;VVPP;8
3334893;NZZ_1995_05_31_a176_seg4_s20;Als sich nach dem zweiten Unterbruch das Schicksal gegen ihn zu wenden schien , kämpfte er vehement und mit Erfolg gegen die Niederlage .;ADJD;und;18;Coord|-2;KON;17
3336492;NZZ_1995_05_02_a7_seg3_s6;Auch die Minister des linken Koalitionspartners Meretz sprachen sich vehement gegen die Enteignungen aus .;ADJD;sprechen;8;Full|3|Pl|Past|Ind;VVFIN;10
3346780;NZZ_1995_05_03_a121_seg7_s6;Die Organisatoren verteidigten sich vehement , sie hätten alle möglichen Vorsichtsmassnahmen getroffen .;ADJD;verteidigen;3;Full|3|Pl|Past|Ind;VVFIN;5
3346803;NZZ_1995_05_03_a121_seg11_s2;Die Organisatoren der « Gotthard-Abfahrt » distanzierten sich an der Pressekonferenz jedoch vehement von den In-line-Skatern , die in Zürich immer wieder zwischen den Tramgleisen vom Zoo her über den Toblerplatz in die Stadt hinunterrasen .;ADJD;distanzieren;7;Full|3|Pl|Past|Ind;VVFIN;13
3347266;NZZ_1995_05_03_a151_seg2_s4;Gekonnt und vehement entlockte er seinen zahlreichen Gitarren brachial verzerrte Klänge , deren Wucht er subtil zu steuern wusste .;ADJD;und;2;Coord|-2;KON;3
3353277;NZZ_1995_05_04_a178_seg2_s3;Obwohl die Turiner vehement auf den Ausgleich drängten , konnte Parma den Minimalvorsprung für den zweiten Uefa-Cup-Final-Match in 14 Tagen in Mailand behaupten .;ADJD;drängen;8;Full|3|Pl|Past|Ind;VVFIN;4
3359868;NZZ_1995_05_05_a175_seg5_s7;Gegen eine solche Einstufung wehrt sich Vater Jolidon allerdings vehement .;ADJD;wehren;5;Full|3|Sg|Pres|Ind;VVFIN;10
3370645;NZZ_1995_05_08_a32_seg4_s23;Der Chef des Integrationsbüros , Bruno Spinner , beteuerte vehement , dass die Beitrittsdiskussion den bilateralen Verhandlungen nicht schade , sondern nütze .;ADJD;beteuern;9;Full|3|Sg|Past|Ind;VVFIN;10
3376629;NZZ_1995_05_09_a27_seg8_s1;Rush Limbaugh , der bei weitem erfolgreichste Radio-Talkmaster der letzten Jahre in Amerika - sein Programm wird täglich von über 660 Radiostationen ausgestrahlt und sein Publikum auf etwa rund 20 Millionen geschätzt - hat sich in seinen Sendungen und in einem Zeitschriftenartikel vehement dagegen verwahrt , die Terrortat von Oklahoma in irgendeinen Zusammenhang mit konservativen Kommentatoren seines Schlages zu bringen oder seine Sendungen als Hasstiraden abzustempeln .;ADJD;verwahren;45;Full|Psp;VVPP;43
3384402;NZZ_1995_05_10_a20_seg3_s2;Nachdem sich alle religiösen Parteien vehement gegen eine liberalere Neufassung ausgesprochen haben , hat nun auch das Parlament der Provinz Punjab eine Resolution verabschiedet , in der jede Änderung abgelehnt wird .;ADJD;aussprechen;11;Full|Psp;VVPP;6
3395229;NZZ_1995_05_11_a198_seg7_s4;Dieser Unfall mutet besonders tragisch an , da Geiger sich - wegen Kollisionsgefahr - vehement gegen die Einrichtung von zwei verschiedenen Pisten für Segel- und Motorflugzeuge gewehrt hatte .;ADJD;wehren;27;Full|Psp;VVPP;15
3395553;NZZ_1995_05_12_a17_seg1_s19;Das Problem stellt sich , wie auch in Zukunft die horizontale Weiterverbreitung der Atomwaffen verhindert werden kann - in einer Welt , in der nach dem Ende des kalten Krieges regionale Konflikte vehement aufbrechen und die Verwendung von Spaltmaterial zur friedlichen Nutzung der Kernenergie ebenso wie das Know-how dazu in vielen Drittweltländern verbreitet ist .;ADJD;aufbrechen;34;Full|-2;VVINF;33
3397382;NZZ_1995_05_12_a96_seg6_s12;So vehement die beiden Schwestern gegen den Rassismus gekämpft hatten , so fremd sind ihnen die gegenwärtigen Debatten der Political Correctness , vor allem was die neuen Sprachregelungen anbelangt .;ADJD;kämpfen;9;Full|Psp;VVPP;2
3402730;NZZ_1995_05_13_a31_seg1_s38;Es wäre eine Überraschung , wenn über diese Neat-Finanzierung 1996/97 nicht an der Urne entschieden würde , stemmen sich doch die Strassenverkehrsverbände vehement gegen eine vorgezogene Sonderfinanzierung zulasten der Automobilisten .;ADJD;stemmen;18;Full|3|Pl|Pres|Ind;VVFIN;23
3408644;NZZ_1995_05_13_a175_seg11_s34;Dementsprechend stritt er jegliche ausländischen Einflüsse auf den Maler vehement ab .;ADJD;streiten;2;Full|3|Sg|Past|Ind;VVFIN;10
3413320;NZZ_1995_05_15_a105_seg3_s20;Diese im linksextremen Spektrum anzusiedelnde Vereinigung agitiert vehement gegen das Polizeigefängnis und gegen die Zwangsmassnahmen im Ausländerrecht .;ADJD;agitieren;7;Full|3|Sg|Pres|Ind;VVFIN;8
3419562;NZZ_1995_05_16_a117_seg11_s2;Arno Lustiger , Überlebender mehrerer Konzentrationslager , widerspricht vehement : Einen Kampf « auf Leben und Tod » habe der jüdische Widerstand in ganz Europa geliefert .;ADJD;widersprechen;8;Full|3|Sg|Pres|Ind;VVFIN;9
3426269;NZZ_1995_05_17_a141_seg9_s8;Beide Verteidiger stellten jedoch die Angaben der Bezirksanwaltschaft vehement in Abrede und sprachen von mindestens 60 Frauen .;ADJD;stellen;3;Full|3|Pl|Past|Ind;VVFIN;9
3427146;NZZ_1995_05_17_a174_seg3_s30;Der Gastklub stürmte nun nicht mehr derart vehement , was zu einem eher ausgeglichenen Geschehen führte .;ADJD;stürmen;3;Full|3|Sg|Past|Ind;VVFIN;8
3428030;NZZ_1995_05_18_a6_seg3_s6;Der Generalsekretär sprach sich aber vehement gegen einen Rückzug der Uno-Truppen aus .;ADJD;sprechen;3;Full|3|Sg|Past|Ind;VVFIN;6
3428128;NZZ_1995_05_18_a13_seg5_s5;Major dürfte derartige Kritik an seinen europapolitischen Vorstellungen schon darum als unbequem empfinden , weil er nach der von ihm im letzten Juni - mit Seitenblick auf den rechtsgerichteten Tory-Flügel - so vehement hintertriebenen Wahl des als zentralistisch ( « federalist » ) verteufelten Jean-Luc Dehaene den jetzigen Kommissionspräsidenten Santer als Wunschkandidaten dargestellt hatte : « der richtige Mann für den richtigen Job » .;ADJD;--;34;Pos|Dat|Sg|Fem;ADJA;33
3440625;NZZ_1995_05_20_a6_seg3_s10;Chen Xitong hatte 1989 den Armee-Einsatz gegen die Bevölkerung vehement befürwortet .;ADJD;befürworten;11;Full|Psp;VVFIN;10
3455183;NZZ_1995_05_23_a35_seg8_s8;Vermutungen , dass das Cargo-Domizil-Konzept wieder verstaatlicht würde , dementierte Fagagnini indessen vehement .;ADJD;dementieren;10;Full|3|Sg|Past|Ind;VVFIN;13
3458901;NZZ_1995_05_23_a157_seg8_s3;Ich setzte mich sogar vehement dafür ein , dass das von der Verfassung garantierte Recht auf freie Meinungsäusserung ( « free speech » ) auf Internet gewahrt bleibt und die dort vorhandene Kreativität nicht durch irgendwelche Verbote oder exorbitante Benutzergebühren abgebaut wird .;ADJD;setzen;2;Full|1|Sg|Past|Ind;VVFIN;5
3459972;NZZ_1995_05_23_a176_seg6_s1;Seit der Gründung des unter der Bezeichnung Micro Concept Car AG ( MCC ) firmierenden schweizerisch-deutschen Joint venture vor einem Jahr ist kaum zu übersehen , dass Mehrheitspartner Mercedes-Benz das Kommando vehement an sich gerissen hat und der Bieler Beitrag mehr und mehr marginalisiert wird .;ADJD;reißen;35;Full|Psp;VVPP;32
3468654;NZZ_1995_05_26_a2_seg4_s15;Doch einige konservative Kongressvertreter agitieren im Verein mit einem Teil der israelischen Lobby in Washington seit langem vehement gegen die Entsendung amerikanischer Friedenstruppen nach dem Golan .;ADJD;.;27;Pun|Sent;$.;18
3472920;NZZ_1995_05_26_a165_seg5_s6;Kantonsrat Daniel Schloeth setzte sich vor den Delegierten vehement ein gegen die Beschränkung der Studienzeit und die Strafgebühr für Studierende , welche diese Studienzeit überschreiten .;ADJD;setzen;4;Full|3|Sg|Past|Ind;VVFIN;9
3473825;NZZ_1995_05_26_a187_seg9_s8;Minute war ein Warn- , Kluiverts im Spagat und mit der äusseren Fussspitze glückhaft an Rossi vorbei gelenkter Abschluss - nach grobem Fehler Bobans - der Genickschuss für die Italiener , die sich vehement auflehnten , dem zweiten Gegentor ( Blind allein vor dem Keeper nach Durchbruch Kanus ) aber näher standen als dem Ausgleich .;ADJD;auflehnen;35;Full|3|Pl|Past|Ind;VVFIN;34
3476009;NZZ_1995_05_27_a17_seg3_s14;Kritik an Pawlaks Kurs war auch für Präsident Walesa einer der Gründe gewesen , warum er vehement auf dessen Ablösung hinarbeitete .;ADJD;hinarbeiten;21;Full|3|Sg|Past|Ind;VVFIN;17
3476594;NZZ_1995_05_27_a37_seg8_s10;Andererseits grenzte sich Lutz vehement gegen die von Goeudevert gezeichnete moralische Neuorientierung ab .;ADJD;grenzen;2;Full|3|Sg|Past|Ind;VVFIN;5
3483953;NZZ_1995_05_27_a215_seg18_s3;"Die Gewerkschaften wehren sich überall vehement gegen eine Herabsetzung der realen Einkommen , was man in gewisser Weise auch verstehen kann ; denn zu ihrem Ziel gehört die Steigerung des Realeinkommens , nicht dessen Verringerung .";ADJD;wehren;3;Full|3|Pl|Pres|Ind;VVFIN;6
3491477;NZZ_1995_05_30_a73_seg6_s11;Turks Behauptung , die Verständigung zwischen BBA und Holvis liege nicht im Interesse der Holvis-Aktionäre , weil diese damit nicht den höchstmöglichen Preis für ihre Aktien erhalten würden , wird am Holvis-Hauptsitz vehement bestritten .;ADJD;bestreiten;34;Full|Psp;VVPP;33
3502462;NZZ_1995_03_02_a124_seg8_s10;Nicht alle muslimischen Länder wehren sich derart vehement gegen die vermeintliche « Kulturinvasion » .;ADJD;wehren;5;Full|3|Pl|Pres|Ind;VVFIN;8
3503866;NZZ_1995_03_02_a140_seg3_s5;Die Rezession zu Beginn der neunziger Jahre schlug sich wirtschaftlich vehement auf das « Tagblatt » nieder , das notgedrungen einen Teil seiner redaktionellen Leistung abbauen musste , was sich allerdings nicht spürbar auf die Qualität auswirkte .;ADJD;schlagen;8;Full|3|Sg|Past|Ind;VVFIN;11
3508262;NZZ_1995_03_03_a140_seg5_s3;Die Gegner bekämpfen alle Vorlagen vehement , denn damit würden die Konsumenten betrogen , die Bio-Bauern bestraft und Tierfabriken gefördert .;ADJD;denn;8;Coord|Denn;KON;6
3517633;NZZ_1995_03_04_a180_seg3_s21;In dieser Auffassung wird er sich durch die Tatsache bestärkt fühlen , dass das Ensemble inzwischen vehement auf seine vorzeitige Ablösung reagiert hat .;ADJD;reagieren;22;Full|Psp;VVPP;17
3527186;NZZ_1995_03_07_a57_seg1_s3;Die Jusos wollen sich nach einer Annahme aber vehement dafür einsetzen , dass die Rentenaltererhöhung rückgängig gemacht wird .;ADJD;einsetzen;11;Full|-2;VVINF;9
3527297;NZZ_1995_03_07_a59_seg18_s8;Wer heute « Bahn 2000 » so vehement bekämpft , müsste sich die Frage gefallen lassen , wie er es mit der sechsspurigen Autobahn Bern-Zürich hält .;ADJD;bekämpfen;9;Full|Psp;VVPP;8
3542334;NZZ_1995_03_09_a81_seg8_s2;"Die FDP wehrt sich weiterhin vehement gegen die Einführung einer neuen Steuer , belaste diese nun den Energie- oder den Stromverbrauch ; sie fordert , dass der allgemeine Haushalt diese Belastung übernehmen müsse .";ADJD;wehren;3;Full|3|Sg|Pres|Ind;VVFIN;6
